Unnamed: 0,job,location,date,company,country
16.0,"Vice President of Global Sales, Aurea Software (Remote) - $400,000/year USD","Sakaka, Al Jawf, Arabie saoudite À distance",Il y a 1 jour,Agoda,saudi
17.0,Senior Forecasting & Planning Analyst (Bangkok-Based),"Riyad, Riyad, Arabie saoudite",Il y a 1 semaine,Bechtel Corporation,saudi
18.0,Field Engineer - Structural (Saudi National),"Riyad, Arabie saoudite Sur site","Il y a 21 heures

                Au cours des 24 dernières heures",Baker Hughes,saudi
19.0,Cementing Field Specialist,"Ahsa, Province de l'Est, Arabie saoudite Sur site",Il y a 1 semaine,Bechtel Corporation,saudi
20.0,Cost Engineer-NEOM,"Sharma, Tabuk, Arabie saoudite Sur site",Il y a 2 semaines,NADEC Foods,saudi
21.0,Certified Salesforce Developer for Saudi Arabia,"Djeddah, La Mecque, Arabie saoudite Sur site",Il y a 1 mois,Antal International,saudi
22.0,KVM Virtualization Engineer,"Djeddah, La Mecque, Arabie saoudite Sur site",Il y a 1 mois,,saudi
23.0,Talent Acquisition Manager,"Riyad, Arabie saoudite Sur site",Il y a 1 jour,,saudi
24.0,Anesthesia Specialist,Province de Riyad Sur site,Il y a 1 mois,,saudi
0.0,Lead Field Civil Engineer (Site),"Riyad, Arabie saoudite Sur site",Il y a 6 jours,Bechtel Corporation,saudi
1.0,Aftermarket Projects Engineer,"First Industrial City, Province de l'Est, Arabie saoudite Sur site","Il y a 10 heures

                Au cours des 24 dernières heures",ITT Inc.,saudi
2.0,Hospitality Recruiter - Based in Riyadh,"Riyad, Riyad, Arabie saoudite Sur site",Il y a 6 jours,Michael Page,saudi
3.0,"Senior Analyst, Partner Communications(Bangkok based, Relocation provided)","Riyad, Riyad, Arabie saoudite",Il y a 1 semaine,Agoda,saudi
4.0,"Business Development Manager, Beds Network – Saudi Arabia (Jeddah based)","Riyad, Riyad, Arabie saoudite",Il y a 2 semaines,Agoda,saudi
5.0,Anesthesia Specialist,"Abha, Asir, Arabie saoudite Sur site",Il y a 1 mois,Antal International,saudi
6.0,"Project Manager, Urban Planning - Saudi Arabia",Province de la Mecque Sur site,Il y a 1 semaine,ewi recruitment,saudi
7.0,Production Planner,"Al Khobar, Province de l'Est, Arabie saoudite Sur site",Il y a 1 mois,Rawabi Holding Group,saudi
8.0,Project Coordinator for a Saudi Engineering Company,"Djeddah, La Mecque, Arabie saoudite Sur site",Il y a 1 mois,GlobalFoundries,saudi
9.0,Assoc Eng Equipment Engineering,Province d’Asir Sur site,Il y a 3 semaines,Agoda,saudi
10.0,"Business Development Manager, Beds Network – Saudi Arabia (Jeddah based)","Riyad, Riyad, Arabie saoudite",Il y a 2 semaines,GlobalFoundries,saudi
11.0,Assoc Eng Equipment Engineering,Province d’Asir Sur site,Il y a 3 semaines,Jet Aviation,saudi
12.0,Training Manager / Flight Operation Administrator,"Djeddah, La Mecque, Arabie saoudite Sur site",Il y a 1 semaine,"McDermott International, Ltd",saudi
13.0,Senior Process Engineer,"Al Khobar, Province de l'Est, Arabie saoudite Sur site",Il y a 2 jours,Jobskey Search and Selection,saudi
14.0,Recruitment Senior Officer,"La Mecque, La Mecque, Arabie saoudite Sur site",Il y a 1 mois,Agoda,saudi
15.0,"Business Development Manager, Beds Network – Saudi Arabia (Jeddah based)","Djeddah, La Mecque, Arabie saoudite",Il y a 2 semaines,Bechtel Corporation,saudi
16.0,"Assistant Resident Engineer - High-voltage substations, Jubail, (International Assignment)","Jubail, Province de l'Est, Arabie saoudite Sur site",Il y a 1 semaine,Areeb Human Resources Company,saudi
17.0,Talent Acquisition Manager,"Riyad, Arabie saoudite Sur site",Il y a 5 jours,Jet Aviation,saudi
18.0,Director of Maintenance (DOM),"Djeddah, La Mecque, Arabie saoudite Sur site",Il y a 1 semaine,Agoda,saudi
19.0,"Business Development Manager, Beds Network – Saudi Arabia (Jeddah based)","Djeddah, La Mecque, Arabie saoudite",Il y a 2 semaines,Network Recruitment,saudi
20.0,Business Development Manager,"Riyad, Arabie saoudite Sur site",Il y a 2 semaines,Bechtel Corporation,saudi
21.0,Lead Structural Engineer (SAMI),"Riyad, Arabie saoudite Sur site",Il y a 1 jour,Eli Lilly and Company,saudi
22.0,Clinical Research Physician,Province de Riyad,Il y a 2 jours,Kyndryl,saudi
23.0,Saudi Procurement Professional,Province de Riyad,Il y a 1 mois,Mood Group Recruitment,saudi
24.0,Maintenance Manager - Flexible Packaging - Saudi Arabia,"Riyad, Riyad, Arabie saoudite Sur site",Il y a 1 mois,,saudi
0.0,"Sales & Marketing Operating Partner, MENA & Consumer Private Equity, Riyadh, Saudi Arabia","Riyad, Riyad, Arabie saoudite",Il y a 2 mois,Jobs via eFinancialCareers,saudi
1.0,Field Engineering Manager,"Riyad, Arabie saoudite Sur site",Il y a 5 jours,Bechtel Corporation,saudi
2.0,Market Manager – Saudi Arabia (Jeddah based),"Riyad, Riyad, Arabie saoudite",Il y a 2 semaines,Agoda,saudi
3.0,Market Manager – Saudi Arabia (Jeddah based),"Riyad, Riyad, Arabie saoudite",Il y a 2 semaines,Agoda,saudi
4.0,Senior Estimator,"Riyad, Arabie saoudite Sur site",Il y a 1 jour,Bechtel Corporation,saudi
5.0,Lead Field Engineer - Architectural 1,"Riyad, Arabie saoudite Sur site",Il y a 6 jours,Bechtel Corporation,saudi
6.0,Microsoft identity Management Senior Specialist,Province de Riyad Sur site,Il y a 1 mois,Jobskey Search and Selection,saudi
7.0,"Senior Ops Specialist/Associate Manager, Partner Communications: (Bangkok Based, relocation provided)","La Mecque, La Mecque, Arabie saoudite",Il y a 1 semaine,Agoda,saudi
8.0,Human Resources Manager,"Dammam, Province de l'Est, Arabie saoudite Sur site",Il y a 3 semaines,Wyndham Hotels & Resorts,saudi
9.0,Hybrid Cloud and Infrastructure Services Presales,Province de Riyad,Il y a 3 mois,Kyndryl,saudi
10.0,Fitter,"Al Khobar, Province de l'Est, Arabie saoudite Sur site",Il y a 2 semaines,Koch Industries,saudi
11.0,"Senior Ops Specialist/Associate Manager, Partner Communications: (Bangkok Based, relocation provided)","Djeddah, La Mecque, Arabie saoudite",Il y a 1 semaine,Agoda,saudi
12.0,Market Manager – Saudi Arabia (Jeddah based),"Djeddah, La Mecque, Arabie saoudite",Il y a 2 semaines,Agoda,saudi
13.0,"Senior Ops Specialist/Associate Manager, Partner Communications: (Bangkok Based, relocation provided)","Riyad, Riyad, Arabie saoudite",Il y a 1 semaine,Agoda,saudi
14.0,Lead Planner,"Sharma, Tabuk, Arabie saoudite Sur site",Il y a 2 semaines,Bechtel Corporation,saudi
15.0,Market Manager – Saudi Arabia (Jeddah based),"Djeddah, La Mecque, Arabie saoudite",Il y a 2 semaines,Agoda,saudi
16.0,ICU Specialist,"Abha, Asir, Arabie saoudite Sur site",Il y a 1 mois,Antal International,saudi
17.0,Senior Operations and Maintenance Engineer,"Riyad, Arabie saoudite Sur site",Il y a 6 jours,Bechtel Corporation,saudi
18.0,Welder,"Al Khobar, Province de l'Est, Arabie saoudite Sur site",Il y a 3 jours,Koch Industries,saudi
19.0,Endodontics Senior Registrar,"Djeddah, La Mecque, Arabie saoudite Sur site",Il y a 1 mois,Antal International,saudi
20.0,Lead Electrical Engineer,"Riyad, Arabie saoudite Sur site",Il y a 6 jours,Bechtel Corporation,saudi
21.0,Construction Manager (Site Manager),"Riyad, Arabie saoudite Sur site",Il y a 5 jours,Bechtel Corporation,saudi
22.0,Product Support Manager,"Riyad, Arabie saoudite Sur site",Il y a 5 jours,Luxury Carts Group,saudi
23.0,color Flexo printer operator,"Djeddah, La Mecque, Arabie saoudite Sur site",Il y a 1 mois,Bechtel Corporation,saudi
24.0,Lead Field Engineer - Mechanical (Site) 1,"Riyad, Arabie saoudite Sur site",Il y a 6 jours,,saudi
0.0,"Data Engineering Analyst, Data Management","Brampton, ON Sur site",Il y a 3 jours,Loblaw Companies Limited,canada
1.0,Loblaw Technology Innovation Intern,"Brampton, ON Sur site",Il y a 5 jours,Loblaw Companies Limited,canada
2.0,Analyst - Payments & Services Intern,"Brampton, ON Sur site",Il y a 4 jours,Loblaw Companies Limited,canada
3.0,IT Operations Data Analyst Summer Co-op,"Toronto, ON Sur site",Il y a 1 semaine,Loblaw Companies Limited,canada
4.0,"Senior Data Analyst, Data Engineering","Brampton, ON Sur site","Il y a 18 heures

                Au cours des 24 dernières heures",Loblaw Companies Limited,canada
5.0,Summer Student,"Brampton, ON Sur site",Il y a 1 semaine,Loblaw Companies Limited,canada
6.0,Summer Student,"Brampton, ON Sur site",Il y a 1 semaine,Loblaw Companies Limited,canada
7.0,Technology Risk - Summer Co-op,"Brampton, ON Sur site",Il y a 1 semaine,Loblaw Companies Limited,canada
8.0,Loblaw Technology Innovation Intern (Developer),"Brampton, ON Sur site",Il y a 5 jours,Loblaw Companies Limited,canada
9.0,Storage/Backup Analyst summer co-op,"Brampton, ON Sur site",Il y a 1 semaine,Loblaw Companies Limited,canada
10.0,"Product Analyst, Digital Health (Co Op)","Toronto, ON Sur site",Il y a 1 semaine,Loblaw Companies Limited,canada
11.0,"Senior Analyst, Business Intelligence","Brampton, ON Sur site",Il y a 5 jours,Loblaw Companies Limited,canada
12.0,Product Manager - Digital Health,"Toronto, ON Sur site",Il y a 1 semaine,Loblaw Companies Limited,canada
13.0,Senior Product Analyst,"Toronto, ON Sur site",Il y a 1 semaine,Loblaw Companies Limited,canada
14.0,Data Quality Specialist (6-8 month Contract),"Toronto, ON Sur site",Il y a 1 semaine,CIBC,canada
15.0,Part Time Data Entry Clerk (Equest),"Kelowna, BC Sur site",Il y a 1 semaine,BCjobs.ca,canada
16.0,Work at Home Data Entry Clerk (Equest),"White Rock, BC À distance",Il y a 1 semaine,BCjobs.ca,canada
17.0,5 People Urgently Need It NOW! From Victoria - Market Research / Surveyor -Work From Home Jobs - Part-Time Job (Occupons Quebec),"Victoria, BC À distance",Il y a 2 semaines,BCjobs.ca,canada
18.0,Part Time Data Entry Clerk (Equest),"Kamloops, BC Sur site",Il y a 1 semaine,BCjobs.ca,canada
19.0,5 People Urgently Need It NOW! From Burnaby- Work From Home Jobs - Part-Time Job (Occupons Quebec),"Burnaby, BC À distance",Il y a 2 semaines,BCjobs.ca,canada
20.0,5 People Urgently Need It NOW From Richmond- Work From Home Jobs - Part-Time Job (Occupons Quebec),"Richmond, BC À distance",Il y a 2 semaines,BCjobs.ca,canada
21.0,Senior Data Scientist,"Brampton, ON Sur site",Il y a 1 mois,Loblaw Companies Limited,canada
22.0,Part Time Sales - Work from Home Remotely (Equest),"Vancouver, BC À distance",Il y a 1 semaine,BCjobs.ca,canada
23.0,Junior Engineer Summer Co-op,"Brampton, ON Sur site",Il y a 1 semaine,Loblaw Companies Limited,canada
24.0,5 People Urgently Need It NOW! From Vancouver - Market Research / Surveyor -Work From Home Jobs - Part-Time Job (Occupons Quebec),"Vancouver, BC À distance",Il y a 2 semaines,BCjobs.ca,canada
0.0,"Senior Software Engineer (iOS, Swift), Trilogy (Remote) - $100,000/year USD","Toronto, ON À distance",Il y a 1 jour,Crossover for Work,canada
1.0,Engineering Sales,"Pickering, ON",Il y a 1 semaine,Jesus College Oxford,canada
2.0,"Vice President Finance Accounting, Trilogy (Remote) - $400,000/year USD","Calgary, AB À distance",Il y a 1 jour,Crossover for Work,canada
3.0,"Vice President of Sales, Trilogy (Remote) - $200,000/year USD","Toronto, ON À distance",Il y a 1 jour,Crossover for Work,canada
4.0,"Vice President Corporate Finance, Trilogy (Remote) - $400,000/year USD","Victoria, BC À distance",Il y a 1 jour,Crossover for Work,canada
5.0,CLK 09R - Regional Support Clerk (BC Public Service),"Oliver, BC Sur site",Il y a 6 jours,BCjobs.ca,canada
6.0,"ISL 30R - Solutions Architect, Messaging - AMENDED: Closing Date Extended (BC Public Service)","Abbotsford, BC Sur site",Il y a 1 semaine,BCjobs.ca,canada
7.0,COMM O 18R - Communications and Engagement Coordinator (BC Public Service),"Victoria, BC Sur site",Il y a 1 semaine,BCjobs.ca,canada
8.0,Personal Support Manager,"Mississauga, ON Sur site",Il y a 4 semaines,Jesus College Oxford,canada
9.0,Personal Support Manager,"Brampton, ON Sur site",Il y a 4 semaines,Jesus College Oxford,canada
10.0,LP 6A - Forensic Psychologist (BC Public Service),"Coquitlam, BC Sur site",Il y a 1 semaine,BCjobs.ca,canada
11.0,CLK ST 11R - Office Manager (BC Public Service),"Campbell River, BC Sur site",Il y a 1 semaine,BCjobs.ca,canada
12.0,"Vice President Corporate Finance, Trilogy (Remote) - $400,000/year USD","Québec, QC À distance",Il y a 1 jour,Crossover for Work,canada
13.0,Personal Support Manager,"Etobicoke, ON Sur site",Il y a 4 semaines,Jesus College Oxford,canada
14.0,"Lead Software Architect, Trilogy (Remote) - $200,000/year USD","Montréal, QC À distance",Il y a 1 jour,Crossover for Work,canada
15.0,Fire Prevention Technician (TransLink),"Vancouver, BC Sur site",Il y a 3 semaines,BCjobs.ca,canada
16.0,Residential Child & Youth Services Ltd (Coastal Mountain Child & Youth Services Ltd.),"Duncan, BC Sur site",Il y a 3 semaines,BCjobs.ca,canada
17.0,"Senior Product Designer, Upland (Remote) - $100,000/year USD","Toronto, ON À distance",Il y a 1 jour,Crossover for Work,canada
18.0,COR SRV 18R_Correctional Officer (BC Public Service),"Kamloops, BC Sur site",Il y a 1 semaine,BCjobs.ca,canada
19.0,SW AST 13R - Social Program Officer Assistant (BC Public Service),"Kamloops, BC Sur site",Il y a 6 jours,BCjobs.ca,canada
20.0,"BAND 4 - Director, Clean Government (BC Public Service)","Victoria, BC Sur site",Il y a 5 jours,BCjobs.ca,canada
21.0,"SPO 24R - Guardianship, Resource & Out of Care Worker AMENDED, POSTING CLOSING DATE EXTENDED (BC Public Service)","Vanderhoof, BC Sur site",Il y a 1 semaine,BCjobs.ca,canada
22.0,"Vice President Finance Accounting, Trilogy (Remote) - $400,000/year USD","Victoria, BC À distance",Il y a 1 jour,Crossover for Work,canada
23.0,Archaeologist (Associate Level) (Equest),"Smithers, BC Sur site",Il y a 6 jours,BCjobs.ca,canada
24.0,SPO 24R (Growth) - CYSN Generalist AMENDED (BC Public Service),"Kelowna, BC Sur site",Il y a 1 semaine,BCjobs.ca,canada
0.0,ISL 24R - Senior IT Procurement Specialist (BC Public Service),"Victoria, BC Sur site",Il y a 5 jours,BCjobs.ca,canada
1.0,Branch Manager (Equest),"Lake Cowichan, BC Sur site",Il y a 1 semaine,BCjobs.ca,canada
2.0,"Assistant/Associate Professor (Clinical), Department of Medicine, Division of General Internal Medicine (C-211214)","Montréal-Ouest, QC Sur site",Il y a 1 semaine,Jesus College Oxford,canada
3.0,LP 5A - Licensed Psychologist (BC Public Service),"Colwood, BC Sur site",Il y a 1 semaine,BCjobs.ca,canada
4.0,LSO FOR 2 - Practices Forester***CLOSING DATE EXTENDED*** (BC Public Service),"Mackenzie, BC Sur site",Il y a 1 semaine,BCjobs.ca,canada
5.0,LSO FORS 2 - Practices Forester (BC Public Service),"Powell River, BC Sur site",Il y a 1 semaine,BCjobs.ca,canada
6.0,Certified Heavy Duty Equipment Technician (City of Prince George),"Prince George, BC Sur site",Il y a 3 jours,BCjobs.ca,canada
7.0,"Assistant Professor (Clinical), Department of Obstetrics and Gynecology, Division of Gynecologic Reproductive Endocrinology and Infertility (C-211027)","Montréal-Ouest, QC Sur site",Il y a 4 semaines,Jesus College Oxford,canada
8.0,ISL 30R - Site Reliability Engineer Lead (BC Public Service),"Victoria, BC Sur site",Il y a 3 jours,BCjobs.ca,canada
9.0,"Assistant Professor (Clinical), Department of Obstetrics and Gynecology, Division of Obstetrics (MFM) (C2-211027)","Montréal-Ouest, QC Sur site",Il y a 4 semaines,Jesus College Oxford,canada
10.0,STO 21R - Operations Technologist - CLOSING DATE EXTENDED (BC Public Service),"Hazelton, BC Sur site",Il y a 1 semaine,BCjobs.ca,canada
11.0,LSO 3 - Land and Resource Specialist (BC Public Service),"Burns Lake, BC Sur site",Il y a 1 semaine,BCjobs.ca,canada
12.0,LSO FOR 2 - Practices Forester - CLOSING DATE EXTENDED (BC Public Service),"Hazelton, BC Sur site",Il y a 1 semaine,BCjobs.ca,canada
13.0,Full-time Pharmacist (QRP Consulting),"Vanderhoof, BC Sur site",Il y a 1 semaine,BCjobs.ca,canada
14.0,LSO OTHR 3 - Industrial Reporting and Evaluation Officer (BC Public Service),"Cranbrook, BC Sur site",Il y a 3 jours,BCjobs.ca,canada
15.0,"Assistant/Associate Professor (Clinical), Department of Medicine, Division of Respiratory Medicine (C2-211214)","Montréal-Ouest, QC Sur site",Il y a 1 semaine,Jesus College Oxford,canada
16.0,"Director, Medical Physics Unit, McGill University","Montréal-Ouest, QC Sur site",Il y a 2 semaines,Jesus College Oxford,canada
17.0,Full Time Retail Sales Merchandiser Canada,"Edmonton, AB Sur site",Il y a 3 semaines,Jesus College Oxford,canada
18.0,"Assistant or Associate Professor (Clinical), Department of Medicine, Division of Rheumatology (C-211112)","Montréal-Ouest, QC Sur site",Il y a 3 semaines,Jesus College Oxford,canada
19.0,LSO FORS 2 - Practices Forester (BC Public Service),"Nelson, BC Sur site",Il y a 1 semaine,BCjobs.ca,canada
20.0,"SPO 27R - Team Leader, Multidisciplinary Team - CLOSING DATE EXTENDED (BC Public Service)","Nakusp, BC Sur site",Il y a 1 semaine,BCjobs.ca,canada
21.0,Registered Nurse (FT),"Grande Prairie, AB Sur site",Il y a 4 semaines,Jesus College Oxford,canada
22.0,STO-RE 21R - Operations Technologist (BC Public Service),"Campbell River, BC Sur site",Il y a 1 semaine,BCjobs.ca,canada
23.0,"SPO 30R - Team Leader, Integrated Services (BC Public Service)","Fort St. James, BC Sur site",Il y a 3 semaines,BCjobs.ca,canada
24.0,CMBC - Maintenance Manager (TransLink),"Vancouver, BC Sur site",Il y a 1 semaine,BCjobs.ca,canada
0.0,STO21R - Auxiliary Meat Hygiene and Agri-Food Inspector (BC Public Service),"Abbotsford, BC Sur site",Il y a 3 jours,BCjobs.ca,canada
1.0,"C NURSE 9 - Integrated Practice Team Leader, CYMH (BC Public Service)","Barrière, BC Sur site",Il y a 6 jours,BCjobs.ca,canada
2.0,ECON 30R - Senior Policy Advisor (BC Public Service),"Victoria, BC Sur site",Il y a 1 semaine,BCjobs.ca,canada
3.0,"SPO 30R - Integrated Practice Team Leader, CYMH (BC Public Service)","Barrière, BC Sur site",Il y a 6 jours,BCjobs.ca,canada
4.0,STO-RE 21R - Operations Technologist (BC Public Service),"Port McNeill, BC Sur site",Il y a 1 semaine,BCjobs.ca,canada
5.0,STO 27R - Senior Advisor Indigenous Relations - AMENDED - CLOSING DATE EXTENDED (BC Public Service),"Coquitlam, BC Sur site",Il y a 1 semaine,BCjobs.ca,canada
6.0,"Open Rank as Assistant, Associate or Full Professor (Clinical), MUHC Director-Division of Dermatology (C2-211207)","Montréal-Ouest, QC Sur site",Il y a 3 semaines,Jesus College Oxford,canada
7.0,STO-RE 27R - Woodlands Supervisor (BC Public Service),"Cranbrook, BC Sur site",Il y a 1 semaine,BCjobs.ca,canada
8.0,"Open Rank as Assistant, Associate or Full Professor (Clinical), McGill Director of the Division of Infectious Diseases (C3-211207)","Montréal-Ouest, QC Sur site",Il y a 3 semaines,Jesus College Oxford,canada
9.0,"BAND 3 - Manager, FrontCounter BC (BC Public Service)","Nanaimo, BC Sur site",Il y a 5 jours,BCjobs.ca,canada
10.0,Full-time Relief Pharmacist (QRP Consulting),"Vancouver, BC Sur site",Il y a 1 semaine,BCjobs.ca,canada
11.0,BAND 4 - Deputy Fire Commissioner (BC Public Service),"Kamloops, BC Sur site",Il y a 1 semaine,BCjobs.ca,canada
12.0,"Open Rank as Assistant, Associate or Full Professor (Clinical), MUHC Director-Division of Infectious Diseases (C4-211207)","Montréal-Ouest, QC Sur site",Il y a 3 semaines,Jesus College Oxford,canada
13.0,"Open Rank of Assistant, Associate or Full Professor (Clinical), McGill Director of the Division of Dermatology (C-211207)","Montréal-Ouest, QC Sur site",Il y a 3 semaines,Jesus College Oxford,canada
14.0,STO-RE 21R - Operations Technologist (BC Public Service),"Vernon, BC Sur site",Il y a 3 jours,BCjobs.ca,canada
15.0,STO R21 - Senior Engineering Technologist (BC Public Service),"Cranbrook, BC Sur site",Il y a 3 jours,BCjobs.ca,canada
16.0,STO-RE 18R - Forest Technologist (BC Public Service),"Burns Lake, BC Sur site",Il y a 1 semaine,BCjobs.ca,canada
17.0,Service Manager (The Inland Group),"Williams Lake, BC Sur site",Il y a 1 semaine,BCjobs.ca,canada
18.0,STO 24R - Senior Environmental Electronics Technologist (BC Public Service),"Prince George, BC Sur site",Il y a 6 jours,BCjobs.ca,canada
19.0,Chef principal – Soutien à l’infrastructure/Senior Manager – Infrastructure Support,"Montréal, QC Sur site",Il y a 1 semaine,Jesus College Oxford,canada
20.0,Senior EHS Management Systems & Sustainability Consultant (Mid-Senior Level) (Equest),"Vancouver, BC",Il y a 1 semaine,BCjobs.ca,canada
21.0,TEO 21R - Scaling Officer-Interior - AMENDED: Closing Date Extended (BC Public Service),"Revelstoke, BC Sur site",Il y a 1 semaine,BCjobs.ca,canada
22.0,"NURSE 7C- Indigenous Outreach Clinician, CYMH - AMENDED (BC Public Service)","Delta, BC Sur site",Il y a 3 semaines,BCjobs.ca,canada
23.0,LSO AGRL 3 - District Range Officer - CLOSING DATE EXTENDED (BC Public Service),"Merritt, BC Sur site",Il y a 3 semaines,BCjobs.ca,canada
24.0,Pharmacist (Floater - Nanaimo) (Save-on-Foods Pharmacy),"Nanaimo, BC Sur site",Il y a 1 semaine,BCjobs.ca,canada
0.0,STO-RE 18R - Forest Technologist (BC Public Service),"Prince George, BC Sur site",Il y a 1 semaine,BCjobs.ca,canada
1.0,ADMN O 30R - Senior Indigenous Relations and Policy Lead (BC Public Service),"Victoria, BC Sur site",Il y a 1 semaine,BCjobs.ca,canada
2.0,Occupational Therapist Maternity Leave (Kootenay Family Place),"Castlegar, BC Sur site",Il y a 1 semaine,BCjobs.ca,canada
3.0,"SPO MH 25 - Indigenous Outreach Clinician, CYMH - AMENDED (BC Public Service)","Delta, BC Sur site",Il y a 3 semaines,BCjobs.ca,canada
4.0,STO-RE 18R - Forest Technologist (BC Public Service),"Burns Lake, BC Sur site",Il y a 1 semaine,BCjobs.ca,canada
5.0,STO 27RE - Senior First Nations Relations Advisor CLOSING DATE EXTENDED (BC Public Service),"Dawson Creek, BC Sur site",Il y a 3 semaines,BCjobs.ca,canada
6.0,STO-RE 18R - Forest Technologist (BC Public Service),"Fort St. James, BC Sur site",Il y a 1 semaine,BCjobs.ca,canada
7.0,University Veterinarian - Academic Associate,"Toronto, ON Sur site",Il y a 4 semaines,Jesus College Oxford,canada
8.0,Director of Sales and Marketing - Maternity Leave,"Trois-Rivières, QC Sur site",Il y a 2 semaines,Jesus College Oxford,canada
9.0,Director of Sales and Marketing - Dual Property (JW & Autograph),"Vancouver, BC Sur site",Il y a 1 semaine,Jesus College Oxford,canada
10.0,"STO-RE 27R - Senior Advisor, Indigenous Relations (BC Public Service)","Burns Lake, BC Sur site",Il y a 4 jours,BCjobs.ca,canada
11.0,"LSO OTHR 3 - Senior Advisor, Indigenous Relations (BC Public Service)","Burns Lake, BC Sur site",Il y a 4 jours,BCjobs.ca,canada
0.0,ADMN O 18R - Intake Officer (BC Public Service),"Victoria, BC Sur site",Il y a 3 jours,BCjobs.ca,canada
1.0,"Remote Bilingual Sr. Team Leader, TB Inbound/Outbound Contact Centre","Québec, Canada À distance",Il y a 6 jours,CIBC,canada
2.0,CLK 11R - Municipal Clerk (BC Public Service),"Vancouver, BC Sur site",Il y a 5 jours,BCjobs.ca,canada
3.0,EXEC ADMIN - Executive Administrative Assistant (BC Public Service),"Victoria, BC Sur site",Il y a 6 jours,BCjobs.ca,canada
4.0,Administrative Assistant,"Montréal-Ouest, QC Sur site",Il y a 1 semaine,Jesus College Oxford,canada
5.0,"Senior Specialist, Security Governance and Assurance, Cyber Security & Technology Risk","Brampton, ON Sur site",Il y a 4 semaines,Loblaw Companies Limited,canada
6.0,"Technical Director, gt.school (Remote) - $640,000/year USD","Ontario, Canada À distance",Il y a 1 jour,Crossover for Work,canada
7.0,FO 24R - Tax Fraud Investigator - Amended (BC Public Service),"Surrey, BC Sur site",Il y a 1 semaine,BCjobs.ca,canada
8.0,"Senior Technical Writer, Trilogy (Remote) - $100,000/year USD","Ontario, Canada À distance",Il y a 1 jour,Crossover for Work,canada
9.0,"Accountant, Trilogy (Remote) - $30,000/year USD","Toronto, ON À distance",Il y a 1 jour,Crossover for Work,canada
10.0,ISL 27R - Database Administrator (Corporate Data Warehouse) (BC Public Service),"Victoria, BC Sur site","Il y a 5 heures

                Au cours des 24 dernières heures",BCjobs.ca,canada
11.0,"Technical Support Engineer, IgniteTech (Remote) - $60,000/year USD","Toronto, ON À distance",Il y a 1 jour,Crossover for Work,canada
12.0,BAND 2 - Gambling Auditor (BC Public Service),"Burnaby, BC Sur site",Il y a 1 semaine,BCjobs.ca,canada
13.0,"Technical Support Engineer, Trilogy (Remote) - $60,000/year USD","Ottawa, ON À distance",Il y a 1 jour,Crossover for Work,canada
14.0,EXEC ADMN - Executive Administrative Assistant (BC Public Service),"Victoria, BC Sur site",Il y a 6 jours,BCjobs.ca,canada
15.0,"Technical Support Engineer, Trilogy (Remote) - $60,000/year USD","Saskatchewan, Canada À distance",Il y a 1 jour,Crossover for Work,canada
16.0,ISL 27R - Senior Technical Analyst (BC Public Service),"Victoria, BC Sur site","Il y a 5 heures

                Au cours des 24 dernières heures",BCjobs.ca,canada
17.0,"Manager, Pharmacy and Healthcare Delivery","Brampton, ON Sur site",Il y a 1 semaine,Loblaw Companies Limited,canada
18.0,"Director Of User Experience, DevGraph (Remote) - $400,000/year USD","Toronto, ON À distance",Il y a 1 jour,Crossover for Work,canada
19.0,"Lead Technical Writer, Trilogy (Remote) - $100,000/year USD","Ontario, Canada À distance",Il y a 1 jour,Crossover for Work,canada
20.0,"Technical Director, gt.school (Remote) - $320,000/year USD","Montréal, QC À distance",Il y a 1 jour,Crossover for Work,canada
21.0,EXEC ADMIN - Executive Administrative Assistant (BC Public Service),"Victoria, BC Sur site",Il y a 6 jours,BCjobs.ca,canada
22.0,ADMN O 21R - Information Schedule Developer and Reporting (BC Public Service),"Victoria, BC Sur site",Il y a 1 semaine,BCjobs.ca,canada
23.0,Job Title: Social Media Marketing – Virtual Intern or CO-OP,"Pickering, ON","Il y a 2 heures

                Au cours des 24 dernières heures",Jesus College Oxford,canada
24.0,"Software Development Engineer - Graduate 2021/2022, Trilogy (Remote) - $60,000/year USD","Toronto, ON À distance",Il y a 1 jour,Crossover for Work,canada
