Unnamed: 0,job,location,date,company,country
20.0,5 People Urgently Need It NOW From Richmond- Work From Home Jobs - Part-Time Job (Occupons Quebec),"Richmond, BC À distance",Il y a 2 semaines,BCjobs.ca,canada
21.0,Senior Data Scientist,"Brampton, ON Sur site",Il y a 1 mois,Loblaw Companies Limited,canada
22.0,Part Time Sales - Work from Home Remotely (Equest),"Vancouver, BC À distance",Il y a 1 semaine,BCjobs.ca,canada
23.0,Junior Engineer Summer Co-op,"Brampton, ON Sur site",Il y a 1 semaine,Loblaw Companies Limited,canada
24.0,5 People Urgently Need It NOW! From Vancouver - Market Research / Surveyor -Work From Home Jobs - Part-Time Job (Occupons Quebec),"Vancouver, BC À distance",Il y a 2 semaines,BCjobs.ca,canada
0.0,"Senior Software Engineer (iOS, Swift), Trilogy (Remote) - $100,000/year USD","Toronto, ON À distance",Il y a 1 jour,Crossover for Work,canada
1.0,Engineering Sales,"Pickering, ON",Il y a 1 semaine,Jesus College Oxford,canada
2.0,"Vice President Finance Accounting, Trilogy (Remote) - $400,000/year USD","Calgary, AB À distance",Il y a 1 jour,Crossover for Work,canada
3.0,"Vice President of Sales, Trilogy (Remote) - $200,000/year USD","Toronto, ON À distance",Il y a 1 jour,Crossover for Work,canada
4.0,"Vice President Corporate Finance, Trilogy (Remote) - $400,000/year USD","Victoria, BC À distance",Il y a 1 jour,Crossover for Work,canada
5.0,CLK 09R - Regional Support Clerk (BC Public Service),"Oliver, BC Sur site",Il y a 6 jours,BCjobs.ca,canada
6.0,"ISL 30R - Solutions Architect, Messaging - AMENDED: Closing Date Extended (BC Public Service)","Abbotsford, BC Sur site",Il y a 1 semaine,BCjobs.ca,canada
7.0,COMM O 18R - Communications and Engagement Coordinator (BC Public Service),"Victoria, BC Sur site",Il y a 1 semaine,BCjobs.ca,canada
8.0,Personal Support Manager,"Mississauga, ON Sur site",Il y a 4 semaines,Jesus College Oxford,canada
9.0,Personal Support Manager,"Brampton, ON Sur site",Il y a 4 semaines,Jesus College Oxford,canada
10.0,LP 6A - Forensic Psychologist (BC Public Service),"Coquitlam, BC Sur site",Il y a 1 semaine,BCjobs.ca,canada
11.0,CLK ST 11R - Office Manager (BC Public Service),"Campbell River, BC Sur site",Il y a 1 semaine,BCjobs.ca,canada
12.0,"Vice President Corporate Finance, Trilogy (Remote) - $400,000/year USD","Québec, QC À distance",Il y a 1 jour,Crossover for Work,canada
13.0,Personal Support Manager,"Etobicoke, ON Sur site",Il y a 4 semaines,Jesus College Oxford,canada
14.0,"Lead Software Architect, Trilogy (Remote) - $200,000/year USD","Montréal, QC À distance",Il y a 1 jour,Crossover for Work,canada
15.0,Fire Prevention Technician (TransLink),"Vancouver, BC Sur site",Il y a 3 semaines,BCjobs.ca,canada
16.0,Residential Child & Youth Services Ltd (Coastal Mountain Child & Youth Services Ltd.),"Duncan, BC Sur site",Il y a 3 semaines,BCjobs.ca,canada
17.0,"Senior Product Designer, Upland (Remote) - $100,000/year USD","Toronto, ON À distance",Il y a 1 jour,Crossover for Work,canada
18.0,COR SRV 18R_Correctional Officer (BC Public Service),"Kamloops, BC Sur site",Il y a 1 semaine,BCjobs.ca,canada
19.0,SW AST 13R - Social Program Officer Assistant (BC Public Service),"Kamloops, BC Sur site",Il y a 6 jours,BCjobs.ca,canada
20.0,"BAND 4 - Director, Clean Government (BC Public Service)","Victoria, BC Sur site",Il y a 5 jours,BCjobs.ca,canada
21.0,"SPO 24R - Guardianship, Resource & Out of Care Worker AMENDED, POSTING CLOSING DATE EXTENDED (BC Public Service)","Vanderhoof, BC Sur site",Il y a 1 semaine,BCjobs.ca,canada
22.0,"Vice President Finance Accounting, Trilogy (Remote) - $400,000/year USD","Victoria, BC À distance",Il y a 1 jour,Crossover for Work,canada
23.0,Archaeologist (Associate Level) (Equest),"Smithers, BC Sur site",Il y a 6 jours,BCjobs.ca,canada
24.0,SPO 24R (Growth) - CYSN Generalist AMENDED (BC Public Service),"Kelowna, BC Sur site",Il y a 1 semaine,BCjobs.ca,canada
0.0,ISL 24R - Senior IT Procurement Specialist (BC Public Service),"Victoria, BC Sur site",Il y a 5 jours,BCjobs.ca,canada
1.0,Branch Manager (Equest),"Lake Cowichan, BC Sur site",Il y a 1 semaine,BCjobs.ca,canada
2.0,"Assistant/Associate Professor (Clinical), Department of Medicine, Division of General Internal Medicine (C-211214)","Montréal-Ouest, QC Sur site",Il y a 1 semaine,Jesus College Oxford,canada
3.0,LP 5A - Licensed Psychologist (BC Public Service),"Colwood, BC Sur site",Il y a 1 semaine,BCjobs.ca,canada
4.0,LSO FOR 2 - Practices Forester***CLOSING DATE EXTENDED*** (BC Public Service),"Mackenzie, BC Sur site",Il y a 1 semaine,BCjobs.ca,canada
5.0,LSO FORS 2 - Practices Forester (BC Public Service),"Powell River, BC Sur site",Il y a 1 semaine,BCjobs.ca,canada
6.0,Certified Heavy Duty Equipment Technician (City of Prince George),"Prince George, BC Sur site",Il y a 3 jours,BCjobs.ca,canada
7.0,"Assistant Professor (Clinical), Department of Obstetrics and Gynecology, Division of Gynecologic Reproductive Endocrinology and Infertility (C-211027)","Montréal-Ouest, QC Sur site",Il y a 4 semaines,Jesus College Oxford,canada
8.0,ISL 30R - Site Reliability Engineer Lead (BC Public Service),"Victoria, BC Sur site",Il y a 3 jours,BCjobs.ca,canada
9.0,"Assistant Professor (Clinical), Department of Obstetrics and Gynecology, Division of Obstetrics (MFM) (C2-211027)","Montréal-Ouest, QC Sur site",Il y a 4 semaines,Jesus College Oxford,canada
10.0,STO 21R - Operations Technologist - CLOSING DATE EXTENDED (BC Public Service),"Hazelton, BC Sur site",Il y a 1 semaine,BCjobs.ca,canada
11.0,LSO 3 - Land and Resource Specialist (BC Public Service),"Burns Lake, BC Sur site",Il y a 1 semaine,BCjobs.ca,canada
12.0,LSO FOR 2 - Practices Forester - CLOSING DATE EXTENDED (BC Public Service),"Hazelton, BC Sur site",Il y a 1 semaine,BCjobs.ca,canada
13.0,Full-time Pharmacist (QRP Consulting),"Vanderhoof, BC Sur site",Il y a 1 semaine,BCjobs.ca,canada
14.0,LSO OTHR 3 - Industrial Reporting and Evaluation Officer (BC Public Service),"Cranbrook, BC Sur site",Il y a 3 jours,BCjobs.ca,canada
15.0,"Assistant/Associate Professor (Clinical), Department of Medicine, Division of Respiratory Medicine (C2-211214)","Montréal-Ouest, QC Sur site",Il y a 1 semaine,Jesus College Oxford,canada
16.0,"Director, Medical Physics Unit, McGill University","Montréal-Ouest, QC Sur site",Il y a 2 semaines,Jesus College Oxford,canada
17.0,Full Time Retail Sales Merchandiser Canada,"Edmonton, AB Sur site",Il y a 3 semaines,Jesus College Oxford,canada
18.0,"Assistant or Associate Professor (Clinical), Department of Medicine, Division of Rheumatology (C-211112)","Montréal-Ouest, QC Sur site",Il y a 3 semaines,Jesus College Oxford,canada
19.0,LSO FORS 2 - Practices Forester (BC Public Service),"Nelson, BC Sur site",Il y a 1 semaine,BCjobs.ca,canada
20.0,"SPO 27R - Team Leader, Multidisciplinary Team - CLOSING DATE EXTENDED (BC Public Service)","Nakusp, BC Sur site",Il y a 1 semaine,BCjobs.ca,canada
21.0,Registered Nurse (FT),"Grande Prairie, AB Sur site",Il y a 4 semaines,Jesus College Oxford,canada
22.0,STO-RE 21R - Operations Technologist (BC Public Service),"Campbell River, BC Sur site",Il y a 1 semaine,BCjobs.ca,canada
23.0,"SPO 30R - Team Leader, Integrated Services (BC Public Service)","Fort St. James, BC Sur site",Il y a 3 semaines,BCjobs.ca,canada
24.0,CMBC - Maintenance Manager (TransLink),"Vancouver, BC Sur site",Il y a 1 semaine,BCjobs.ca,canada
0.0,STO21R - Auxiliary Meat Hygiene and Agri-Food Inspector (BC Public Service),"Abbotsford, BC Sur site",Il y a 3 jours,BCjobs.ca,canada
1.0,"C NURSE 9 - Integrated Practice Team Leader, CYMH (BC Public Service)","Barrière, BC Sur site",Il y a 6 jours,BCjobs.ca,canada
2.0,ECON 30R - Senior Policy Advisor (BC Public Service),"Victoria, BC Sur site",Il y a 1 semaine,BCjobs.ca,canada
3.0,"SPO 30R - Integrated Practice Team Leader, CYMH (BC Public Service)","Barrière, BC Sur site",Il y a 6 jours,BCjobs.ca,canada
4.0,STO-RE 21R - Operations Technologist (BC Public Service),"Port McNeill, BC Sur site",Il y a 1 semaine,BCjobs.ca,canada
5.0,STO 27R - Senior Advisor Indigenous Relations - AMENDED - CLOSING DATE EXTENDED (BC Public Service),"Coquitlam, BC Sur site",Il y a 1 semaine,BCjobs.ca,canada
6.0,"Open Rank as Assistant, Associate or Full Professor (Clinical), MUHC Director-Division of Dermatology (C2-211207)","Montréal-Ouest, QC Sur site",Il y a 3 semaines,Jesus College Oxford,canada
7.0,STO-RE 27R - Woodlands Supervisor (BC Public Service),"Cranbrook, BC Sur site",Il y a 1 semaine,BCjobs.ca,canada
8.0,"Open Rank as Assistant, Associate or Full Professor (Clinical), McGill Director of the Division of Infectious Diseases (C3-211207)","Montréal-Ouest, QC Sur site",Il y a 3 semaines,Jesus College Oxford,canada
9.0,"BAND 3 - Manager, FrontCounter BC (BC Public Service)","Nanaimo, BC Sur site",Il y a 5 jours,BCjobs.ca,canada
10.0,Full-time Relief Pharmacist (QRP Consulting),"Vancouver, BC Sur site",Il y a 1 semaine,BCjobs.ca,canada
11.0,BAND 4 - Deputy Fire Commissioner (BC Public Service),"Kamloops, BC Sur site",Il y a 1 semaine,BCjobs.ca,canada
12.0,"Open Rank as Assistant, Associate or Full Professor (Clinical), MUHC Director-Division of Infectious Diseases (C4-211207)","Montréal-Ouest, QC Sur site",Il y a 3 semaines,Jesus College Oxford,canada
13.0,"Open Rank of Assistant, Associate or Full Professor (Clinical), McGill Director of the Division of Dermatology (C-211207)","Montréal-Ouest, QC Sur site",Il y a 3 semaines,Jesus College Oxford,canada
14.0,STO-RE 21R - Operations Technologist (BC Public Service),"Vernon, BC Sur site",Il y a 3 jours,BCjobs.ca,canada
15.0,STO R21 - Senior Engineering Technologist (BC Public Service),"Cranbrook, BC Sur site",Il y a 3 jours,BCjobs.ca,canada
16.0,STO-RE 18R - Forest Technologist (BC Public Service),"Burns Lake, BC Sur site",Il y a 1 semaine,BCjobs.ca,canada
17.0,Service Manager (The Inland Group),"Williams Lake, BC Sur site",Il y a 1 semaine,BCjobs.ca,canada
18.0,STO 24R - Senior Environmental Electronics Technologist (BC Public Service),"Prince George, BC Sur site",Il y a 6 jours,BCjobs.ca,canada
19.0,Chef principal – Soutien à l’infrastructure/Senior Manager – Infrastructure Support,"Montréal, QC Sur site",Il y a 1 semaine,Jesus College Oxford,canada
20.0,Senior EHS Management Systems & Sustainability Consultant (Mid-Senior Level) (Equest),"Vancouver, BC",Il y a 1 semaine,BCjobs.ca,canada
21.0,TEO 21R - Scaling Officer-Interior - AMENDED: Closing Date Extended (BC Public Service),"Revelstoke, BC Sur site",Il y a 1 semaine,BCjobs.ca,canada
22.0,"NURSE 7C- Indigenous Outreach Clinician, CYMH - AMENDED (BC Public Service)","Delta, BC Sur site",Il y a 3 semaines,BCjobs.ca,canada
23.0,LSO AGRL 3 - District Range Officer - CLOSING DATE EXTENDED (BC Public Service),"Merritt, BC Sur site",Il y a 3 semaines,BCjobs.ca,canada
24.0,Pharmacist (Floater - Nanaimo) (Save-on-Foods Pharmacy),"Nanaimo, BC Sur site",Il y a 1 semaine,BCjobs.ca,canada
0.0,STO-RE 18R - Forest Technologist (BC Public Service),"Prince George, BC Sur site",Il y a 1 semaine,BCjobs.ca,canada
1.0,ADMN O 30R - Senior Indigenous Relations and Policy Lead (BC Public Service),"Victoria, BC Sur site",Il y a 1 semaine,BCjobs.ca,canada
2.0,Occupational Therapist Maternity Leave (Kootenay Family Place),"Castlegar, BC Sur site",Il y a 1 semaine,BCjobs.ca,canada
3.0,"SPO MH 25 - Indigenous Outreach Clinician, CYMH - AMENDED (BC Public Service)","Delta, BC Sur site",Il y a 3 semaines,BCjobs.ca,canada
4.0,STO-RE 18R - Forest Technologist (BC Public Service),"Burns Lake, BC Sur site",Il y a 1 semaine,BCjobs.ca,canada
5.0,STO 27RE - Senior First Nations Relations Advisor CLOSING DATE EXTENDED (BC Public Service),"Dawson Creek, BC Sur site",Il y a 3 semaines,BCjobs.ca,canada
6.0,STO-RE 18R - Forest Technologist (BC Public Service),"Fort St. James, BC Sur site",Il y a 1 semaine,BCjobs.ca,canada
7.0,University Veterinarian - Academic Associate,"Toronto, ON Sur site",Il y a 4 semaines,Jesus College Oxford,canada
8.0,Director of Sales and Marketing - Maternity Leave,"Trois-Rivières, QC Sur site",Il y a 2 semaines,Jesus College Oxford,canada
9.0,Director of Sales and Marketing - Dual Property (JW & Autograph),"Vancouver, BC Sur site",Il y a 1 semaine,Jesus College Oxford,canada
10.0,"STO-RE 27R - Senior Advisor, Indigenous Relations (BC Public Service)","Burns Lake, BC Sur site",Il y a 4 jours,BCjobs.ca,canada
11.0,"LSO OTHR 3 - Senior Advisor, Indigenous Relations (BC Public Service)","Burns Lake, BC Sur site",Il y a 4 jours,BCjobs.ca,canada
0.0,ADMN O 18R - Intake Officer (BC Public Service),"Victoria, BC Sur site",Il y a 3 jours,BCjobs.ca,canada
1.0,"Remote Bilingual Sr. Team Leader, TB Inbound/Outbound Contact Centre","Québec, Canada À distance",Il y a 6 jours,CIBC,canada
2.0,CLK 11R - Municipal Clerk (BC Public Service),"Vancouver, BC Sur site",Il y a 5 jours,BCjobs.ca,canada
3.0,EXEC ADMIN - Executive Administrative Assistant (BC Public Service),"Victoria, BC Sur site",Il y a 6 jours,BCjobs.ca,canada
4.0,Administrative Assistant,"Montréal-Ouest, QC Sur site",Il y a 1 semaine,Jesus College Oxford,canada
5.0,"Senior Specialist, Security Governance and Assurance, Cyber Security & Technology Risk","Brampton, ON Sur site",Il y a 4 semaines,Loblaw Companies Limited,canada
6.0,"Technical Director, gt.school (Remote) - $640,000/year USD","Ontario, Canada À distance",Il y a 1 jour,Crossover for Work,canada
7.0,FO 24R - Tax Fraud Investigator - Amended (BC Public Service),"Surrey, BC Sur site",Il y a 1 semaine,BCjobs.ca,canada
8.0,"Senior Technical Writer, Trilogy (Remote) - $100,000/year USD","Ontario, Canada À distance",Il y a 1 jour,Crossover for Work,canada
9.0,"Accountant, Trilogy (Remote) - $30,000/year USD","Toronto, ON À distance",Il y a 1 jour,Crossover for Work,canada
10.0,ISL 27R - Database Administrator (Corporate Data Warehouse) (BC Public Service),"Victoria, BC Sur site","Il y a 5 heures

                Au cours des 24 dernières heures",BCjobs.ca,canada
11.0,"Technical Support Engineer, IgniteTech (Remote) - $60,000/year USD","Toronto, ON À distance",Il y a 1 jour,Crossover for Work,canada
12.0,BAND 2 - Gambling Auditor (BC Public Service),"Burnaby, BC Sur site",Il y a 1 semaine,BCjobs.ca,canada
13.0,"Technical Support Engineer, Trilogy (Remote) - $60,000/year USD","Ottawa, ON À distance",Il y a 1 jour,Crossover for Work,canada
14.0,EXEC ADMN - Executive Administrative Assistant (BC Public Service),"Victoria, BC Sur site",Il y a 6 jours,BCjobs.ca,canada
15.0,"Technical Support Engineer, Trilogy (Remote) - $60,000/year USD","Saskatchewan, Canada À distance",Il y a 1 jour,Crossover for Work,canada
16.0,ISL 27R - Senior Technical Analyst (BC Public Service),"Victoria, BC Sur site","Il y a 5 heures

                Au cours des 24 dernières heures",BCjobs.ca,canada
17.0,"Manager, Pharmacy and Healthcare Delivery","Brampton, ON Sur site",Il y a 1 semaine,Loblaw Companies Limited,canada
18.0,"Director Of User Experience, DevGraph (Remote) - $400,000/year USD","Toronto, ON À distance",Il y a 1 jour,Crossover for Work,canada
19.0,"Lead Technical Writer, Trilogy (Remote) - $100,000/year USD","Ontario, Canada À distance",Il y a 1 jour,Crossover for Work,canada
20.0,"Technical Director, gt.school (Remote) - $320,000/year USD","Montréal, QC À distance",Il y a 1 jour,Crossover for Work,canada
21.0,EXEC ADMIN - Executive Administrative Assistant (BC Public Service),"Victoria, BC Sur site",Il y a 6 jours,BCjobs.ca,canada
22.0,ADMN O 21R - Information Schedule Developer and Reporting (BC Public Service),"Victoria, BC Sur site",Il y a 1 semaine,BCjobs.ca,canada
23.0,Job Title: Social Media Marketing – Virtual Intern or CO-OP,"Pickering, ON","Il y a 2 heures

                Au cours des 24 dernières heures",Jesus College Oxford,canada
24.0,"Software Development Engineer - Graduate 2021/2022, Trilogy (Remote) - $60,000/year USD","Toronto, ON À distance",Il y a 1 jour,Crossover for Work,canada
0.0,"Associate Software Engineer, Trilogy (Remote) - $60,000/year USD","Toronto, ON À distance",Il y a 1 jour,Crossover for Work,canada
1.0,CLK 09R - Wildfire Financial Services Clerk (BC Public Service),"Williams Lake, BC Sur site",Il y a 5 jours,BCjobs.ca,canada
2.0,"Software Quality Assurance Engineer, Virtasant (Remote) - $60,000/year USD","Toronto, ON À distance",Il y a 1 jour,Crossover for Work,canada
3.0,"Product Owner, Trilogy (Remote) - $100,000/year USD","Ontario, Canada À distance",Il y a 1 jour,Crossover for Work,canada
4.0,"Director, Technology Enablement","Brampton, ON Sur site",Il y a 1 semaine,Loblaw Companies Limited,canada
5.0,"Salesforce Administrator, Aurea Software (Remote) - $60,000/year USD","Toronto, ON À distance",Il y a 1 jour,Crossover for Work,canada
6.0,"Senior Manager, Delivery","Brampton, ON Sur site",Il y a 1 mois,Loblaw Companies Limited,canada
7.0,CLK 09R - Administrative Assistant / Office Assistant (BC Public Service),"Surrey, BC Sur site",Il y a 5 jours,BCjobs.ca,canada
8.0,Senior Technical Manager,"Brampton, ON Sur site",Il y a 5 jours,Loblaw Companies Limited,canada
9.0,"Chief Executive Officer, gt.school (Remote) - $400,000/year USD","Toronto, ON À distance",Il y a 1 jour,Crossover for Work,canada
10.0,"Technical Consultant, Aurea Software (Remote) - $30,000/year USD","Toronto, ON À distance",Il y a 1 jour,Crossover for Work,canada
11.0,"Technical Product Owner, Trilogy (Remote) - $100,000/year USD","Toronto, ON À distance",Il y a 1 jour,Crossover for Work,canada
12.0,"Head of Customer Support, Trilogy (Remote) - $400,000/year USD","Toronto, ON À distance",Il y a 1 jour,Crossover for Work,canada
13.0,"Senior Data Scientist, Bloom Institute of Technology (BloomTech) (Remote) - $60,000/year USD","Toronto, ON À distance",Il y a 1 jour,Crossover for Work,canada
14.0,Financial Accountant (Equest),"Surrey, BC Sur site",Il y a 1 semaine,BCjobs.ca,canada
15.0,"Senior Site Reliability Engineer, Technology Platforms","Brampton, ON Sur site",Il y a 3 jours,Loblaw Companies Limited,canada
16.0,"Junior Software Engineer, Trilogy (Remote) - $60,000/year USD","Montréal, QC À distance",Il y a 1 jour,Crossover for Work,canada
17.0,"Technical Consultant, Aurea Software (Remote) - $30,000/year USD","Ontario, Canada À distance",Il y a 1 jour,Crossover for Work,canada
18.0,"Software Implementation Consultant, Aurea Software (Remote) - $30,000/year USD","Toronto, ON À distance",Il y a 1 jour,Crossover for Work,canada
19.0,STO 24 - GIS Coordinator - South (BC Public Service),"100 Mile House, BC Sur site",Il y a 1 semaine,BCjobs.ca,canada
20.0,"Software Test Engineer, Virtasant (Remote) - $60,000/year USD","Toronto, ON À distance",Il y a 1 jour,Crossover for Work,canada
21.0,"Implementation Consultant, Aurea Software (Remote) - $30,000/year USD","Ontario, Canada À distance",Il y a 1 jour,Crossover for Work,canada
22.0,CLK 09R - Member Support and Decision Processing Clerk (BC Public Service),"Victoria, BC Sur site",Il y a 1 semaine,BCjobs.ca,canada
23.0,"Account Manager, IgniteTech (Remote) - $100,000/year USD","Toronto, ON À distance",Il y a 1 jour,Crossover for Work,canada
24.0,"Machine Learning Engineer, Bloom Institute of Technology (BloomTech) (Remote) - $60,000/year USD","Toronto, ON À distance",Il y a 1 jour,Crossover for Work,canada
0.0,"Frontend Developer, React (Semaphore Solutions Inc.)","Victoria, BC À distance",Il y a 1 semaine,BCjobs.ca,canada
1.0,"Staff Software Engineer (with C), Skyvera (Remote) - $100,000/year USD","Toronto, ON À distance",Il y a 1 jour,Crossover for Work,canada
2.0,"Principal Software Engineer, gt.school (Remote) - $320,000/year USD","Montréal, QC À distance",Il y a 1 jour,Crossover for Work,canada
3.0,"Director of Information Technology, Trilogy (Remote) - $200,000/year USD","Toronto, ON À distance",Il y a 1 jour,Crossover for Work,canada
4.0,ISL 24R - Privacy and Security Analyst (BC Public Service),"Victoria, BC",Il y a 1 semaine,BCjobs.ca,canada
5.0,"Senior Manager, Technology Risk and Controls Management","Brampton, ON Sur site",Il y a 1 mois,Loblaw Companies Limited,canada
6.0,"Head of Customer Support, Trilogy (Remote) - $200,000/year USD","Toronto, ON À distance",Il y a 1 jour,Crossover for Work,canada
7.0,"Software Engineer, gt.school (Remote) - $80,000/year USD","Toronto, ON À distance",Il y a 1 jour,Crossover for Work,canada
8.0,CLK 11R - Field Office Clerk (BC Public Service),"Kelowna, BC Sur site",Il y a 6 jours,BCjobs.ca,canada
9.0,CLK 15R - Compliance Analyst (BC Public Service),"Victoria, BC Sur site",Il y a 6 jours,BCjobs.ca,canada
10.0,ADMN O 18R - Adjudication Analyst (BC Public Service),"Victoria, BC Sur site",Il y a 3 jours,BCjobs.ca,canada
11.0,"Inside Sales Representative, Trilogy (Remote) - $100,000/year USD","Toronto, ON À distance",Il y a 1 jour,Crossover for Work,canada
12.0,SPO 24R - Guardianship Worker (BC Public Service),"Abbotsford, BC Sur site","Il y a 5 heures

                Au cours des 24 dernières heures",BCjobs.ca,canada
13.0,"Developer, Upland (Remote) - $30,000/year USD","Toronto, ON À distance",Il y a 1 jour,Crossover for Work,canada
14.0,Senior Business Analyst (Equest),"Surrey, BC Sur site",Il y a 1 semaine,BCjobs.ca,canada
15.0,"Head Of User Experience, DevGraph (Remote) - $400,000/year USD","Toronto, ON À distance",Il y a 1 jour,Crossover for Work,canada
16.0,Senior QA Automation Developer,"Brampton, ON Sur site",Il y a 1 semaine,Loblaw Companies Limited,canada
17.0,"C Developer, Skyvera (Remote) - $100,000/year USD","Toronto, ON À distance",Il y a 1 jour,Crossover for Work,canada
18.0,Hardware Asset Manager,"Brampton, ON Sur site",Il y a 3 semaines,Loblaw Companies Limited,canada
19.0,"Software Engineer, Aurea Software (Remote) - $60,000/year USD","Toronto, ON À distance",Il y a 1 jour,Crossover for Work,canada
20.0,"Software Engineer, Trilogy (Remote) - $30,000/year USD","Toronto, ON À distance",Il y a 1 jour,Crossover for Work,canada
21.0,"Software Engineer, Trilogy (Remote) - $100,000/year USD","Toronto, ON À distance",Il y a 1 jour,Crossover for Work,canada
22.0,Client Accounting Coordinator,"Toronto, ON Sur site",Il y a 2 mois,Jesus College Oxford,canada
23.0,"Cloud Support Engineer, Trilogy (Remote) - $60,000/year USD","Toronto, ON À distance",Il y a 1 jour,Crossover for Work,canada
24.0,"Developer, TelcoDR (Remote) - $80,000/year USD","Toronto, ON À distance",Il y a 1 jour,Crossover for Work,canada
0.0,SW AST 13R - Social Worker Assistant (BC Public Service),"Abbotsford, BC Sur site",Il y a 1 semaine,BCjobs.ca,canada
1.0,"Software Engineer, Trilogy (Remote) - $100,000/year USD","Ontario, Canada À distance",Il y a 1 jour,Crossover for Work,canada
2.0,CLK ST 11R - Program Assistant (BC Public Service),"Victoria, BC Sur site",Il y a 1 semaine,BCjobs.ca,canada
3.0,ADMN O 15R - Regulations Documents Analyst - CLOSING DATE EXTENDED (BC Public Service),"Victoria, BC Sur site",Il y a 1 semaine,BCjobs.ca,canada
4.0,ISL 24R - Business Analyst (BC Public Service),"Victoria, BC",Il y a 5 jours,BCjobs.ca,canada
5.0,"Frontend Developer, Trilogy (Remote) - $100,000/year USD","Toronto, ON À distance",Il y a 1 jour,Crossover for Work,canada
6.0,CLK 09R - Regional Administration Clerk (BC Public Service),"Coquitlam, BC Sur site",Il y a 5 jours,BCjobs.ca,canada
7.0,"Financial Controller, Trilogy (Remote) - $100,000/year USD","Toronto, ON À distance",Il y a 1 jour,Crossover for Work,canada
8.0,Letter Carrier - Delivery Agent (Canada Post),"Victoria, BC Sur site",Il y a 5 jours,BCjobs.ca,canada
9.0,Sr Administrative Assistant (BC Public Service),"Vancouver, BC Sur site",Il y a 1 semaine,BCjobs.ca,canada
10.0,"Full Stack Engineer, Virtasant (Remote) - $80,000/year USD","Toronto, ON À distance",Il y a 1 jour,Crossover for Work,canada
11.0,ECON 24R - Economic Analyst (BC Public Service),"Victoria, BC Sur site",Il y a 4 jours,BCjobs.ca,canada
12.0,"Sales Development Representative, IgniteTech (Remote) - $60,000/year USD","Toronto, ON À distance",Il y a 1 jour,Crossover for Work,canada
13.0,CLK 09R - Program Assistant (BC Public Service),"Nanaimo, BC Sur site","Il y a 5 heures

                Au cours des 24 dernières heures",BCjobs.ca,canada
14.0,"Director of Product Management, Trilogy (Remote) - $400,000/year USD","Toronto, ON À distance",Il y a 1 jour,Crossover for Work,canada
15.0,"Software Developer, Trilogy (Remote) - $30,000/year USD","Toronto, ON À distance",Il y a 1 jour,Crossover for Work,canada
16.0,"Game Programmer, gt.school (Remote) - $160,000/year USD","Toronto, ON À distance",Il y a 1 jour,Crossover for Work,canada
17.0,"Senior Coordinator, HR","Brampton, ON Sur site",Il y a 4 semaines,Loblaw Companies Limited,canada
18.0,"Senior Specialist, Security Risk","Brampton, ON Sur site",Il y a 3 semaines,Loblaw Companies Limited,canada
19.0,"Senior Software Engineer, gt.school (Remote) - $80,000/year USD","Toronto, ON À distance",Il y a 1 jour,Crossover for Work,canada
20.0,"Software Engineer, Trilogy (Remote) - $100,000/year USD","Calgary, AB À distance",Il y a 1 jour,Crossover for Work,canada
21.0,ClK 09R - Claims Administrator (BC Public Service),"Vancouver, BC Sur site",Il y a 3 jours,BCjobs.ca,canada
22.0,ISL 24R - Quality Assurance Lead (BC Public Service),"Victoria, BC Sur site",Il y a 1 semaine,BCjobs.ca,canada
23.0,"Full-stack Developer, Trilogy (Remote) - $60,000/year USD","Toronto, ON À distance",Il y a 1 jour,Crossover for Work,canada
24.0,CLK 11R - Fish and Wildlife Permit Clerk (BC Public Service),"Williams Lake, BC Sur site",Il y a 1 semaine,BCjobs.ca,canada
0.0,"Software Engineer, TelcoDR (Remote) - $80,000/year USD","Toronto, ON À distance",Il y a 1 jour,Crossover for Work,canada
1.0,"Software Developer, Trilogy (Remote) - $100,000/year USD","Toronto, ON À distance",Il y a 1 jour,Crossover for Work,canada
